{"$schema":"https://json-schema.org/draft/2020-12/schema","$id":"https://thedailyline.bet/schemas/video/v1/render-manifest.schema.json","title":"RenderManifest","type":"object","additionalProperties":false,"required":["schema_version","render_manifest_id","render_spec_id","render_spec_digest","render_job_ref","tdla_stage_run_ref","render_attempt_ref","renderer_adapter_ref","renderer_release_ref","artifact_ref","content_hash","container","codec","width","height","fps","duration_ms","file_size_bytes","render_started_at","render_finished_at","probe_summary","manifest_digest"],"properties":{"schema_version":{"const":"render-manifest.v1"},"render_manifest_id":{"$ref":"common.schema.json#/$defs/Id"},"render_spec_id":{"$ref":"common.schema.json#/$defs/Ref"},"render_spec_digest":{"$ref":"common.schema.json#/$defs/Digest"},"render_job_ref":{"$ref":"common.schema.json#/$defs/Ref"},"tdla_stage_run_ref":{"$ref":"common.schema.json#/$defs/Ref"},"render_attempt_ref":{"$ref":"common.schema.json#/$defs/Ref"},"renderer_adapter_ref":{"$ref":"common.schema.json#/$defs/Ref"},"renderer_release_ref":{"$ref":"common.schema.json#/$defs/Ref"},"artifact_ref":{"$ref":"common.schema.json#/$defs/Ref"},"content_hash":{"$ref":"common.schema.json#/$defs/Digest"},"container":{"type":"string"},"codec":{"type":"string"},"width":{"type":"integer","minimum":1},"height":{"type":"integer","minimum":1},"fps":{"type":"integer","minimum":1},"duration_ms":{"type":"integer","minimum":1},"file_size_bytes":{"type":"integer","minimum":1},"render_started_at":{"$ref":"common.schema.json#/$defs/Timestamp"},"render_finished_at":{"$ref":"common.schema.json#/$defs/Timestamp"},"probe_summary":{"type":"object"},"manifest_digest":{"$ref":"common.schema.json#/$defs/Digest"}}}
