{"schema_version":"render-manifest.v1","render_manifest_id":"render-manifest.mlb.sf-lad.1a","render_spec_id":"render-spec.mlb.sf-lad.1a","render_spec_digest":"sha256:93a3f7dc5735d086fd1ad78b5f0863826229d4c3f7be6b9d12ee51384ab7706d","render_job_ref":"render-job.mlb.sf-lad.1a","tdla_stage_run_ref":"stage-run.fixture.001","render_attempt_ref":"run-attempt.fixture.001","renderer_adapter_ref":"remotion-adapter@1.0.0","renderer_release_ref":"remotion-bundle@fixture","artifact_ref":"artifact://video/mlb-sf-lad-1a.mp4","content_hash":"sha256:12fd62de24c7350f49c3843e0b91ed9674ee2feb363c78761d4bd44df3a774be","container":"mp4","codec":"h264","width":1080,"height":1920,"fps":30,"duration_ms":15000,"file_size_bytes":2500000,"render_started_at":"2026-09-08T16:12:00Z","render_finished_at":"2026-09-08T16:12:30Z","probe_summary":{"decodable":true,"black_frame_ratio":"0.0","audio_present":false},"manifest_digest":"sha256:f70a860b89c7f45910f3e3850bd6945721037b348ecf2f3bd705d8afb8b0a752"}
